{
  "$schema": "http://json-schema.org/draft-07/schema#",
  "type": "object",
  "properties": {
    "roles": {"type": "array", "items": {"type": "string"}},
    "features": {"type": "object"},
    "admin_only": {"type": "array", "items": {"type": "string"}},
    "cleanup_whitelist": {"type": "array", "items": {"type": "string"}},
    "allowed_commands": {"type": "array", "items": {"type": "string"}},
    "safe_mode": {"type": "boolean"},
    "read_only": {"type": "boolean"}
  },
  "required": ["roles", "features"]
}
